titulo,institución,url_curso,id_curso,reseñas,revisores,fecha_reseñas,valoración
Machine Learning,Stanford University,https://www.coursera.org/learn/machine-learning,machine-learning,"This is an extremely basic course. Machine learning is built on mathematics, yet this course treats mathematics as a mysterious monster to be avoided at all costs, which unfortunately left this student feeling frustrated and patronized. So much time is wasted in the videos with arduous explanations of trivialities, and so little taken up with the imparting of meaningful knowledge, that in the end I abandoned the videos altogether. The quizes were basic (largely based on recall of, rather than application of knowledge), as were the programming assignments (nearly all of which were spoon-fed, with the tasks sometimes being simple as multiplying two matrices together).If you are serious about machine learning and comfortable with mathematics (e.g. elementary linear algebra and probability), do yourself a favour and take Geoff Hinton's Neural Networks course instead, which is far more interesting and doesn't shy away from serious explanations of the mathematics of the underlying models.",By Deleted A,"Mar 18, 2017",1
Indigenous Canada,University of Alberta,https://www.coursera.org/learn/indigenous-canada,indigenous-canada,"There are several reasons why I rated this course as being poor.  First, the presentation style does not make use of the capabilities of the medium, namely a significant (perhaps 70 to 80%) portion of the course is just lecturing.   There are flashes of material on the screen behind the presenter but, most of the time, there is no specific discussion of the picture, diagram or map.   The course would be enhanced significantly by using videos, real interviews (rather than just having the interviewee speak about the topic just like a lecturer), and by really incorporating graphics into the presentation.   My second reason is that the material is presented in a very superficial manner.   I realize that this is an introductory course but the course organizers/presenters need to go in depth into a few of the examples rather than just quickly going over them.    Thirdly, there is very limited resource material given and the access to that material is not very user friendly.    For example, if one wanted to get more information on a  particular treaty, it would be helpful to have the reference to that directly incorporated into the course notes so that one could click on the reference and bring up an article with more details.   ",By Art H,"Nov 21, 2017",1
The Science of Well-Being,Yale University,https://www.coursera.org/learn/the-science-of-well-being,the-science-of-well-being,"The course is mostly about the opinion of the lecturer, which can be summed up to ""social media is bad"" and ""money doesn't make you happy"".  A very simple minded world view is presented, without critical notions challenging that view or the more complex science behind emotions.From Yale I would have expected a course that challenges such simple views and empoweres students to find the ideal path for themselves.",By Julia H,"May 01, 2018",1
Technical Support Fundamentals,Google,https://www.coursera.org/learn/technical-support-fundamentals,technical-support-fundamentals,"Course was good overall. I will not take the time to discuss in detail the information taught; it was delivered well and was valuable. However, after watching many many minutes of these videos, it became really redundant for the first 15 seconds of each video to be an animation reminding me of where I am in the course. This is redundant because it is obvious where you are in the course when you navigate to any video.. in any course. The website displays where you are. I do not feel I need to be reminded with 15-20 seconds of silent animations showing me where I am; I just want the video to start. Secondly, it was really frustrating to be failed on the final writing by my peers for the most heinous complaint. We were directed to describe how to make a peanut butter and jelly sandwich to someone who has never seen one before. Because this is all the information given, I have to assume the user has seen some sand-which; just not a peanut butter and jelly one. I do not feel I should have to teach someone how to open a bag of bread. It should be common knowledge that something has to be opened to get it out. I should not have to teach kitchen etiquette and cleanliness. One user who failed me commented that because I did not direct him to set the bread on to a clean plate... that he was confused; and could have mis understood to the point where he placed the sandwich on the floor. Another user said that I should have described how to hold the knife. He did not know if he should hold it by the sharp end, or the handle. One of those users marked me off for not being concise because it did not use bullet points or numbers and that he was expecting a recipe format. Look! I am not here to suppose a user came out of a cave. When you fail me for these types of issues using this logic; that same logic makes me think I should describe how to make a sandwich by growing your own wheat, making grain, baking bread, growing strawberries to make jelly, etc. But I did not go that far! No... I simply re wrote my project and upload to accommodate these 3 users by including that the bread should be opened, how to hold a a utensil, and I even included images of the sandwich so that the user could check their work as it is assembled to ensure the user could make a sandwich in 14 simple short sentence steps labeled accordingly. Well guess what?! My project was graded by another 3 users who complained that it is common sense how to hold a knife and remove bread from a bag and that I should have given them more credit for having some level of food assembly knowledge and I barely passed. I passed by 1 point. Yah, they almost failed me for being too lengthy. Honestly, I only added 3 or 4 short sentences compared to the original. Being graded by your peers gives too brought of feedback in cases like this. If the last 3 users would have graded by first paper, I would have passed. If the first set of users would have graded by second paper I would have passed. Lastly, I got an email upon completion of the first course that said my certificate was ready to print once I uploaded my photo ID (drivers license) along with a second photo of me for validation. Once I uploaded these 2 images; I got a notice that there was no certificate to be given for this particular course. I would not have shared my personal information with you at this point in time if I knew nothing would be available to print yet. That too was frustrating. ",By Daniel W,"May 23, 2018",1
Become a CBRS Certified Professional Installer by Google,Google - Spectrum Sharing,https://www.coursera.org/learn/google-cbrs-cpi-training,google-cbrs-cpi-training,"Pretty dry, but I was able to pass with just two complete watches so I'm happy about that.  As usual there were some questions on the final exam that were NO WHERE in the course, which is annoying but far better than many microsoft tests I have taken.  Never found the suplimental material that the course references... but who cares... i passed!",By Robert S,"Feb 12, 2020",4
Financial Markets,Yale University,https://www.coursera.org/learn/financial-markets-global,financial-markets-global,"This course is virtually worthless. I couldn't follow the lectures, and I have a PhD and have been a tenured professor for almost two decades. The online course is based on snippets taken from face-to-face lectures and breakout sessions, and the result is utter incoherence. The instructor frequently refers to concepts that have not yet been encountered in the online version of the course; makes extensive use of mathematical notations and formulas whose variables are never properly explained; and generally does a poor job of explaining the material. This online version of the Yale course was obviously slapped together with very little thought and production value; it's one of those unsuccessful attempts to bring in revenue on the cheap, creating an online version out of existing face-to-face material, rather than building a real online course from scratch. This was wasted money and time. This attempt to capitalize on the Yale brand is pathetic.    ",By James R,"Apr 23, 2019",1
Introduction to Psychology,Yale University,https://www.coursera.org/learn/introduction-psychology,introduction-psychology,"I am so sorry to say that the ""animation"" makes this course impossible to get through. Imagine your lecturer but without eye contact, without body language or the slow pacing across the front of the room, without the subtle human connection we take for granted. Instead he is replaced by the same 5 drawings repeated ad nauseum against the same stagnant background. Add some literal nausea by slowly zooming in and out for no reason and some obnoxious sound effects to drown out the speaker which in no way improves the his otherwise calm and deliberate lecture style.I've taken a couple classes with Coursera, including a Paul Bloom Course I enjoyed immensely. This the first course I've spent money on. I deeply regret not watching a couple videos before purchasing the course. ",By Jacquelin B,"Dec 10, 2018",1
Programming for Everybody (Getting Started with Python),University of Michigan,https://www.coursera.org/learn/python,python,I did not find this course helpful. The assignments seem to ask for more info that you've been taught in any of the videos. My analogy for the course is this: It's like making a newborn baby watch a video on swimming and then throwing it into the ocean and acting shocked when it doesn't know how to swim. The mentors in the discussion forum are condescending and do not help when you don't understand the terms they are using. I would not recommend this course for beginners.,By Eric V H,"Oct 05, 2017",1
The Bits and Bytes of Computer Networking,Google,https://www.coursera.org/learn/computer-networking,computer-networking,"As a complete and utter beginner to IT, I feel like all of the information presented in this course is in a backward and awkward way. Everything feels so segmented that I'm having a lot of trouble putting it all together in the correct way. There doesn't seem to be a natural flow to any of the lessons and it feels more like a professional stating something than actually teaching it. I've had to completely use outside sources for how to actually do the Peer Review assignment. I feel like all the learning I've done is from hearing about it here and researching it elsewhere.",By Kelley F,"Oct 26, 2018",1
AI For Everyone,DeepLearning.AI,https://www.coursera.org/learn/ai-for-everyone,ai-for-everyone,"Very general, as a large chunck of it could apply with little change to other topics, such as IT in general, management of change etc.in the end, you know quite little, just a thin, very thin layer of knowledge, not even enough for friends discussion.To pay 45$ fo this is realovercharge, for 4 weeks with quite little substance each week.",By Jean-Philippe B,"Aug 27, 2019",1
Crash Course on Python,Google,https://www.coursera.org/learn/python-crash-course,python-crash-course,"I can't give this course higher than 1 star until they fix the bugs in the quizzes.For those of you who say ""It works for me, it's a problem in your code"", you may not have enough experience with these types of bugs. For Week 3 Quiz - While Loops, problems 3 & 4:Bug observations: 1) Works intermittently. In problem 3, it kept saying ""No Output"" when running it. I switched from Edge (Chromium) browser to Chrome, and it worked. Same code. Then, I retook the test (still in Chrome), and problem 3 timed out even though it passed previously and the code was the same. 2) Code works fine in an external IDE such as VS Code and PyCharm, but when typed in manually into Coursera, it will time out or say ""No Output"". 3) Problem 4 will keep outputting a progress bar when you run it with messages saying ""Compiling, uploading, going to the moon and back,..."" before finally outputting the correct solution. Then when submitting the quiz, it ""Times Out After 5"" No doubt due to 'going to the Moon and back'.My credentials:I am a professional Software Engineer with over 13 years of experience working at Amazon and Microsoft. I have written production code in Java, C#, and Python among other languages.",By Jonathan L,"Jan 19, 2020",1
Psychological First Aid,Johns Hopkins University,https://www.coursera.org/learn/psychological-first-aid,psychological-first-aid,"Unfortunately, I think this class missed the mark.  Though the explanation of the RAPID model was adequate, I don't think the assessments were consistent with the material (mentioning a topic in a slide is not discussing it).  When taking the assessment, if I get a wrong answer, explain why it's wrong in the review.  Let the assessment continue to be a learning tool - otherwise it's trial and error.  I thought the videos were incredibly outdated and showed little practical application.  The vignettes were probably the most helpful, however I don't feel adequately prepared for deployment.  That is, what does actual deployment look like?  It was stated in one of the last sessions that we should expect 8-15 victims/day - what does that truly look like?  One person in a gym with one client doesn't give me the ""feel.""  I would have liked to see a typical setup for PFA responders, show the chaos vs. organization, the panic vs. calm, the typical vs. atypical.  Lastly, what does it look like when a PFA responder encounters a case s/he cannot/should not handle?  Are there psychologists available?  What does that transition look like - how is that handled?",By Scott R,"Feb 11, 2020",1
Neural Networks and Deep Learning,DeepLearning.AI,https://www.coursera.org/learn/neural-networks-deep-learning,neural-networks-deep-learning,"This is a good course with good explanation but the only problem with this course is that it covers so much information all at once during the entire week and then there is just literally one or two programming assignment at the end. There should be exercise questions after every video to apply those skills taught in theory into programming. I now know general concept of deep learning but I still barely have a clue on how to code those concepts. If I wanted to code all that myself I still wouldn't even know where to start, where to get the data etc etc because the programming assignments were  just, now write this, now write that. Also there should be a help button where mentors should be available because we have tons of questions after learning a new concept. We cant just type all questions in the discussions forum and then then wait till someone replies and then that question gets lost among the pile of other questions. Especially in programming assignments when we get stuck and then dont have a clue what to do now. For $50 a month, the teaching structure is really poor. Even khan academy has a much better educational structure. and its all free too.  I am a college student with a part time job and I am contributing 70% of my earnings towards this course because my future depends on it.",By Mohammad S B H,"Apr 28, 2019",1
What is Data Science?,IBM,https://www.coursera.org/learn/what-is-datascience,what-is-datascience,"Too much introduction. There is no need to spend so much time on it. People that take this course usually understand what is data science. they need to learn real knowledge, not spend the whole week on introduction. ",By Jianfei Z,"Jan 10, 2019",1
Successful Negotiation: Essential Strategies and Skills,University of Michigan,https://www.coursera.org/learn/negotiation-skills,negotiation-skills,"The course was not what I expected. In my opinion there is no academic foundation but most likely evolved science. There have been times that was eager to finish the video. The bibliography was poor and the lecture slides very bad. Also, the whole subject of the course is the professor's book, word for word, so that means in case you buy the book, you have the hole course, but not the certificate.The least I can say, is that this act is unprofessional, anti-ideological, and it does not take the course in another level with more knowledge.",By Theodoros E,"Nov 10, 2018",1
Fundamentals of Project Planning and Management,University of Virginia,https://www.coursera.org/learn/uva-darden-project-management,uva-darden-project-management,"The course itself probably is good, although it wasn't interesting to me. I've asked to leave, to un-enroll from the course, but the Coursera system wasn't clear enough to show I was out from the course. Against my will, I was charged after the 7 days trial what upsets me a lot. The Coursera engine is not user-friendly at all.  ",By Luis E d S,"Sep 30, 2020",1
Project Launch,"University of California, Irvine",https://www.coursera.org/learn/project-management,project-management,"Content is broken. Links don't work. Content is duplicated. Quiz questions have the answers in them. Language is inconsistent. Videos that are supposed to be included instead tell you that they're ""been removed due to copyright violations."" Some videos aren't available outside the US. etc. etc. etc. etc. etc.The course is essentially a failed project.",By Jason L,"Sep 11, 2018",1
"Brand Management: Aligning Business, Brand and Behaviour",London Business School,https://www.coursera.org/learn/brand,brand,"I was eager to study a course from coursera..But i can't take it..Lecture is good,but the peers review is not good and not upto standard..I have taken many course from other digital platforms and enjoyed a lot..I will surely never take any course from coursera..",By Jeny J,"May 09, 2020",1
Writing in the Sciences,Stanford University,https://www.coursera.org/learn/sciwrite,sciwrite,"The certificate has a bad quality. ""Standford"" sign just like a copy-paste name from the web. Not good",By M R P,"May 25, 2020",1
Stanford Introduction to Food and Health,Stanford University,https://www.coursera.org/learn/food-and-health,food-and-health,"Hi,I was looking for a good introduction course to food and nutrition and, alas, this is not it.I knew 90% of the things discussed in this course, and I was expecting more, but all I got was very basic advices (""eat less"", ""don't eat crap"", etc.), all with videoclips and music which got annoying really quick.Disappointing.Take care.",By Massimo P,"Jan 21, 2016",1
"HTML, CSS, and Javascript for Web Developers",Johns Hopkins University,https://www.coursera.org/learn/html-css-javascript-for-web-developers,html-css-javascript-for-web-developers,"If you don't want to actually learn what anything means and just get walked through steps on how to do things then take this course. But if you're a beginner to HTML, CSS, and Java Script, this isn't for you. He doesn't actually TEACH you anything, he just takes you through the process. They haven't updated the course content to actually match what is on GitHub's page, so from the start you have to go into the FAQs to figure out where to go from there. It's really frustrating because he will just skip steps, and because he doesn't explain WHY he's doing something, if you miss a step, you get completely lost. I've taken a few coursera courses, and this was the most frustrating course I have taken. ",By Christina R,"Mar 18, 2017",1
Excel Skills for Business: Essentials,Macquarie University,https://www.coursera.org/learn/excel-essentials,excel-essentials,Excel you can learn through practiceYou cant just study excel by doing some excise in the worksheet provided by the tutorWhen you really stuck for excel in office please search that doubt in google and find outdont waste time by doing this kind of course in excelthe course is too long and boringplease dont opt for this course if you wants to save your time...............Course content really good...........,By PRAISE T,"Apr 28, 2020",1
Introduction to Negotiation: A Strategic Playbook for Becoming a Principled and Persuasive Negotiator,Yale University,https://www.coursera.org/learn/negotiation,negotiation,"Left after two videos. Incredibly difficult to understand. Felt like I was on a high school geometry class. Negotiating should be simple, not difficult.",By Audrey C,"Dec 15, 2017",1
"Everyday Excel, Part 1",University of Colorado Boulder,https://www.coursera.org/learn/everyday-excel-part-1,everyday-excel-part-1,"No point enrolling if you don't want to pay for the certificate. I understand that the assignments or extra materials are for those who pay, but with this course, there is no point even starting without paying - as all the material, including praticing material that the tutor works with are not accessable. Just waste of time - trying to figure out if it's worth something. It would be fair to just say that at the beginnig.The course (at least the beginning) is really super basic and anyone who ever opend excel can skip at least week 1. For that reason I didn't want to pay, I wanted to see how it is, if I can learn something new - maybe later on. Well, I will never find out and I'm going to watch Excel is fun instead. ",By Petra M,"Apr 27, 2020",1
Learning How to Learn: Powerful mental tools to help you master tough subjects,University of California San Diego,https://www.coursera.org/learn/learning-how-to-learn,learning-how-to-learn,"this course states tons of info that is obvious. I mean tons. at one point the instructor says if there is a class review before a test it would be a good idea to attend. At another point her colleague says you can get a lot of intellectual stimulation by having smart peers to talk to. They also say your brain will work better if you exercise and get a good night's sleep. Are you serious? This is your advice? Could this be any more obvious? The course is filled with obvious statements like this making it much longer than it needs to be. Seriously, it could be cut in half if not by two thirds. They also tell you the names of different chemicals in your brain. How this helps you learn better I don't know. There are a few good pieces of advice here and there. It's a shame you have to listen to so many lectures to hear them. They could have cut out the obvious stuff and got to the point much quicker.",By Patrick M,"Aug 20, 2017",1
Google Cloud Platform Fundamentals: Core Infrastructure,Google Cloud,https://www.coursera.org/learn/gcp-fundamentals,gcp-fundamentals,"Do you like looking at
loading screens? Do you like mindlessly copying commands from one window to
another without any decision making? Do you like listening to google product advertisements?
GREAT! Then this course is for you. Bonus points if you like to listen to
soulless drones reading scripts.PS:
This course is easy is you can copy and paste. But you will not really learn!",By Sebastian R,"Oct 19, 2019",1
Viral Marketing and How to Craft Contagious Content,University of Pennsylvania,https://www.coursera.org/learn/wharton-contagious-viral-marketing,wharton-contagious-viral-marketing,"I really wanted to love this course. The video content offers a few tiny pearls of wisdom, but I gather that you could just read the book called Contagion and get exactly the same content without spending $100. Apprehensive about other Coursera offerings now. ",By Madison R,"Dec 13, 2017",1
Python Data Structures,University of Michigan,https://www.coursera.org/learn/python-data,python-data,"Instructor, Dr. Chuck, is terrific.  However, assignments are incredibly difficult.  You are supposed to spend no matter than a few hours a week on the course.  I spent over 100 hours alone on the assignments.  The mentors that are supposed to help you did not help at all.  Very poorly put together second module that does not prepare you to complete the assignments",By Frederik J E,"Jan 24, 2017",1
Private Equity and Venture Capital,Università Bocconi,https://www.coursera.org/learn/private-equity,private-equity,Too simple to be realistic,By Charles Z,"May 30, 2016",1
First Step Korean,Yonsei University,https://www.coursera.org/learn/learn-korean,learn-korean,"too fast paced, not suited for absolute beginners. first week takes alone about 3 weeks to complete and master",By Karen J,"Sep 05, 2016",1
"Introduction to TensorFlow for Artificial Intelligence, Machine Learning, and Deep Learning",DeepLearning.AI,https://www.coursera.org/learn/introduction-tensorflow,introduction-tensorflow,"Far too basic - almost nothing about Tensorflow - graphs, tensors, estimators, tf.data, etc. The course is a bunch of pre-built examples using the Keras APIs to hit run on in Google collab. This is a very gentle introduction to Keras APIs, with no discussion of what's actually happening with Tensorflow.",By Charles,"Apr 28, 2019",1
