titulo,institución,url_curso,id_curso,reseñas,revisores,fecha_reseñas,valoración
Introdução à Ciência da Computação com Python Parte 1,Universidade de São Paulo,https://www.coursera.org/learn/ciencia-computacao-python-conceitos,ciencia-computacao-python-conceitos,"Há um nítido descompasso entre o conteúdo apresentado nas atividades e o exigido nas tarefas. O conteúdo dos vídeos é básico, o professor, ao invés de explicar a linguagem gasta o tempo tentando montar ""programinhas"" básicos, criando o que já deveria ter sido preparado com antencedencia, gasta tempo, inclusive, tentando localizar o diretório onde havia salvado programas anteriores.Os monitores mais parecem oráculos tão esotéricos os texto. Quando não se restringem ao ""leiam o texto"" (como se isso ajudasse algo). Um teve a ""pérola"" de afirmar que ""são problemas semelhantes aos reais"", oras, qualquer um pode perceber a distância entre os enunciados e os ""requisitos"" da vida real, seja na forma, seja no conteúdo.

",By Luiz E d C F,"Aug 25, 2018",1
Stochastic processes,National Research University Higher School of Economics,https://www.coursera.org/learn/stochasticprocesses,stochasticprocesses,"I do believe the lecturer is incapable in Mathematics, even cannot give clear definitions...1) Mathematical concepts were not stated clearly... Even definitions are messed up (i.e. the lecture does not list all conditions needed for a concept...).. e.g. the definition for Fourier/inverse Fourier transform (not correct); Definition for ergodic is not right (there are a lot of definitions for ergodic Markov Processes., depending on the type of processes.) It's fine the the instructor only uses one of them, but he does not specify what conditions he enforced, even if you used the mean-square sense ergodic, you should SAY it!!2) A lot of repeating lectures. e.g. week7.2 lectures, half of it repeated the proof of ""K(s,t) continuous iff K(s,t) continuous along the diagonal"" this is identical the lecture 6.4 properties of covariance function.3) a lot of errors in homework questions! Even in questions in each video... Not just one, but a ton of them. Please, there are only 6 questions in a quiz and 5 of them have wrong answers... It could only tell how sloppy or how incapable the instructor is 4) As for the content, it is really just an introductory course. If the purpose was to introduce topics in stochastic processes, can you please at least state the definitions correctly and clearly? If the purpose was to focus on one of the most important stochastic process -- Brownian Motion, there isn't any important part emphasized in the course, even not a proof from Random walk to 1-d Brownian motion... 5) The last thing (just my complaint), is that the pen he used is really squeaky...errrrrr",By tau,"Jun 19, 2018",1
Foundations for Big Data Analysis with SQL,Cloudera,https://www.coursera.org/learn/foundations-big-data-analysis-sql,foundations-big-data-analysis-sql,Having peer graded assignments is a waste of everyone's time.,By Shobhit G,"May 29, 2020",1
"Innovation Through Design: Think, Make, Break, Repeat",The University of Sydney,https://www.coursera.org/learn/innovation-through-design,innovation-through-design,"Sloppy content for a course offered by the so-called top 50 global universities. Too busy defining from one terminology to another design terminology such as wireframe, prototype, mock-ups, etc. Week 4 has the most robust modules, included 'Identifying and using design principles' based on Donald Norman's book, ""The Design of Everyday Things."" I discourage you to enroll in this course.",By Juhri S,"Apr 26, 2020",1
Perfect Tenses and Modals,"University of California, Irvine",https://www.coursera.org/learn/perfect-tenses-modals,perfect-tenses-modals,"I finished the course in September, but you are still taking money from my card for this course.
I urgently need your official contact.Please send me asap",By PIERO D G,"Mar 12, 2020",1
Getting Started with Azure,LearnQuest,https://www.coursera.org/learn/cloud-azure-intro,cloud-azure-intro,The course is basically read Azure documentation.,By Jobian G,"Aug 28, 2020",1
Moralities of Everyday Life,Yale University,https://www.coursera.org/learn/moralities,moralities,I have not yet received my completion certificate i have also done some courses in coursera but i received those certificate immediately after i finished it but for this course not received the certificate,By R H,"May 24, 2020",1
Revisão Sistemática e Meta-análise,Universidade Estadual de Campinas,https://www.coursera.org/learn/revisao-sistematica,revisao-sistematica,Curso muito basico dá um overview sobre a revisão mas com pouca aplicação pratica de como fazer.,By Josy D O V ,"Apr 10, 2020",2
Understanding child development: from synapse to society,Utrecht University,https://www.coursera.org/learn/child-development,child-development,"It was mostly like a encyclopedia!  The professor does't teach, It's like he is reading a summery of a textbook very fast. ",By Zahra T,"Feb 21, 2020",1
Introduction to G Suite,Google Cloud,https://www.coursera.org/learn/introduction-g-suite,introduction-g-suite,"I'm just doing this for the certification; I've been doing this for years. Man, is this poorly written and boring! Obviously, it hasn't been proofread (""poject""?), and there are quiz questions that won't accept proper answers. Just because you haven't taught us about domain aliases yet doesn't mean that's not an acceptable way to get a user to receive email from multiple addresses!",By JW,"Sep 26, 2019",1
Aprendiendo a aprender: Poderosas herramientas mentales con las que podrás dominar temas difíciles (Learning How to Learn),University of California San Diego,https://www.coursera.org/learn/aprendiendo-a-aprender,aprendiendo-a-aprender,"I think this course has very interesting information but it needs a way better format. It needs agile presentations, better, infographics, graphics and design and to be much more flexible and fun.I have not finished it but it does not make me get involved in the content even it is very interesting.It needs a better script and handling of the information to be able to conect with new students.",By Luis E E G,"Apr 29, 2016",1
Building Batch Data Pipelines on GCP,Google Cloud,https://www.coursera.org/learn/batch-data-pipelines-gcp,batch-data-pipelines-gcp,Do not waste your time doing this course/specialisation.  The labs are extremely buggy and do not fully work making this course similar to studying chemistry without ever doing a single lab; instead the labs are just described to you.  The video lectures are good and could be better the pace of the lectures was a little quicker - which you can adjust yourself if needed.I'm going to see if I can cancel my subscription to this dodgy specialisation - a first for my time with Coursera!,By g m,"Oct 02, 2020",1
Financial Planning for Young Adults,University of Illinois at Urbana-Champaign,https://www.coursera.org/learn/financial-planning,financial-planning,"Uninteresting, useless and painfully boring. Some topics were embarrassingly out of date or excruciatingly rudimentary. Videos were lackluster and the teachers were too distracted by their prompt cards and scripts to show any sign of interest in their topic. I definitely need more courses to expand on the few things I did learn.",By Olivia D K,"May 25, 2020",1
Quantitative Methods,University of Amsterdam,https://www.coursera.org/learn/quantitative-methods,quantitative-methods,This Course is not really free. You must pay to access quizzes and peer graded assignments.Coursera is really moving downhill quickly in terms of free course offerings. It's such a pity.,By Rachael W,"Apr 13, 2017",1
"Introduction to Self-Determination Theory: An approach to motivation, development and wellness",University of Rochester,https://www.coursera.org/learn/self-determination-theory,self-determination-theory,of course the information was great butafter week 2 everything was almost predictable through the first two week ,By Hamza A,"Apr 06, 2020",3
The Technology of Music Production,Berklee College of Music,https://www.coursera.org/learn/technology-of-music-production,technology-of-music-production,"I've just completed the course subject to peer review grading.  I must say that this was the WORST online course I've ever taken and I've taken a lot of online courses (including YouTube tutorials by people who were clearly intoxicated when creating their masterpieces).  To begin, the recommended software options for screen movies and presentation are awful choices - not to mention ""Prezi"" is subscription service.  I didn't use it.  Try Open Office which has a ""PowerPoint"" type presentation software if you are looking to save costs.  There's also an enormous technical problem with the screen movie makers suggested (at least with the PC versions).  You cannot record from your microphone and capture internal sound card information (i.e. sounds produced by your DAW) simultaneously with any of the ""suggested"" programs I tried.  The solution was a virtual sound card (I used Voice Meeter) where I could route the sounds accordingly so you could hear the sound produced by my DAW while I spoke.  Considering this is a technology course, you would think this would be addressed. It is not.There is almost no practical discussion.  There's plenty of ""what,"" --- an overwhelming amount of what actually --- but not much ""how"" or ""why.""Others may experience this course differently depending on your goals.  If you record vocals and real instruments and want to learn how to do this so everything sounds fantastic, this isn't the course for you.  There's a tiny bit of that discussed with microphone placement and the like, but it quickly moves to digital sound creation.  If you want to use synths and effects and noise things and such to create EDM music ... well, this isn't the course for you either, but maybe it would be more beneficial to you than most other categories.  So, who is this course for?  I can't say I'm sure of the answer to that.  If you are wanting to be a sound designer, perhaps you would learn the vocabulary for sound design but not much ""how.""  If you use Logix as your DAW, perhaps you will learn where something is you hadn't seen before (although the videos are hard to follow as some things are happening off screen or aren't the focus of the video). In the end, this course was very much a ""self teaching"" course.  I didn't learn much from the video lectures provided by Berklee other than application of a few terms in music I'd never considered much with a background in playing instruments rather than playing a digital synth, like ""ADSR.""  I spent more time on other websites and YouTube videos and in my DAW's operation manual as we were often told, ""Go to your DAW and figure out how to use an XYZ."" Rarely did it include ""how and why"" to use that XYZ for musicality. The quizzes were awful as well. There's a lot of ""minutia"" detail in the lectures that never seems to have any relevance because there's no practical application discussed.  Make sure you know this not very relevant information because it will be on the quiz --- like how to determine the word length and bit depth using some formula involving 2 to the power of something.... it still doesn't make since because I don't know why or how it applies.  Also, note that not everything is completely uniform in DAWs with some terms being different in each one.  This was extremely confusing because I don't use Logix and the lessons do.  I had a terrible time figuring out many things simply because my DAW had another term or button name for it.I'm glad this is over. I feel like I learned a little bit, but don't feel like it's information I'll retain for long since I have no idea how to use much of the information for my purposes.  Maybe on a game of Jeopardy?Sorry for the length of this, but I hope you find the information helpful in deciding whether you will benefit from this class.",By Jay M,"Mar 28, 2017",2
Code Yourself! An Introduction to Programming,The University of Edinburgh,https://www.coursera.org/learn/intro-programming,intro-programming,This is a very bad course I wouldn't recommend it to anyone as it doesn't concern to any coding.,By Saatvik G,"Dec 06, 2016",1
Success,University of Pennsylvania,https://www.coursera.org/learn/wharton-success,wharton-success,"Ok course. When I am taking a course from Wharton school, and from adult learning perspective, more is expected than simply small lectures and few activities. Some areas that I see this may be improved...1) Latest evidence based support (few articles/papers) on achievement and satisfaction (Success both parameters). This is widely discussed field as subjective and objective career success. 2) In addition to SAME - better instruments/scale those are easily available online. 3) Some better links to career related articles from Harvard/California management review or organization dynamics on the topics covered. ",By Santosh S,"Apr 19, 2017",2
Chemicals and Health,Johns Hopkins University,https://www.coursera.org/learn/chemicals-health,chemicals-health,content is good but videos are not so good,By Guido P,"Jul 05, 2020",2
Improving your statistical inferences,Eindhoven University of Technology,https://www.coursera.org/learn/statistical-inferences,statistical-inferences,I dropped the course at  Lecture 1.2 when it was supposed to really teach me what is p-value but it failed. A 20 min video without telling much about p-value and also adding more confusion and unanswered questions at the end. Like what is p-value distribution? I expected to receive a decent step by step tutorial on statistics starting from basics but it was just another convoluted stuff on statistics.,By Dashakol,"Sep 21, 2018",1
Fundamentals of Finance,University of Pennsylvania,https://www.coursera.org/learn/finance-fundamentals,finance-fundamentals,"The instructor understands the subject well and knows what she's talking about. The notes and the downloads are great study aids. But the multiple tech issues taking the tests is an ongoing and still unresolved problem. Sometimes the data is accepted and credited, other times there is an issue with the data being received. Monitors for this course experience the same problems and have stated as much in the forums. In week three, discussions drop, questions remain unanswered. I tried to unenroll according to the instructions provided (https://learner.coursera.help/hc/en-us/articles/208279756-Unenroll-from-a-course) but there was no option to ""leave course"". So the tech issues surrounding this course make it not worth taking.            ",By JLMcCloskey,"Aug 29, 2020",1
How Google does Machine Learning,Google Cloud,https://www.coursera.org/learn/google-machine-learning,google-machine-learning,The notebook based demos are unfortunately pretty useless as labs. All of these courses would be much improved with real labs that require the student to build the system.,By Mike W,"Jun 22, 2019",1
Object-Oriented Design,University of Alberta,https://www.coursera.org/learn/object-oriented-design,object-oriented-design,"Even when videos are OK, there are a lot of issues on this course:1 - Even when they states in the course intro that ""You will be challenged in the capstone project to apply your knowledge of object-oriented design by evolving and documenting a Java codebase with corresponding UML documentation."", reality shows that you will earn a certificate only if you are able to develop  in Android language, what it was far, very far from my interest when enrolled. if I had known I had to develop on Android I would not have enrolled, and I am wondering the reason why they did not remark that on the course intro to avoid any confusion.2 - You are evaluated from other learners so, at the end, in case of doubt you will never be sure if you are right or the learner that is evaluating you is as wrong as you. There are no videos explaining proposed solutions so you will die in doubts if it is the case.3 - However, they can solve points 1 and 2 by keeping instructors participating actively in forums helping and guiding learners (in fact, this is the reason why I have paid for the course) but the reality is that the instructors are near to ""invisible"" and a lot of questions remains unanswered.For these reasons I feel totally cheated and will not try to finish the course and will lost my money.if I wanted to learn android I would have signed up for a course on that subject and not in a UML design course.My intention was to enrol me in the whole certification but I have realised that all the courses are Android based (and none of the them inform about such requirement) and after suffer the lack of help from instructors I will not enrol (or at least I will no pay) for them.",By Javier L,"Oct 16, 2017",1
Introduction to Intellectual Property,University of Pennsylvania,https://www.coursera.org/learn/introduction-intellectual-property,introduction-intellectual-property,"peer reviewed final exam was a damn joke. 1. the clear parameters of the grading ""rubric"" were not disclosed prior to my writing and submission of my final exam. 2. as if the random peer that graded my exam was not flunking the class. Which means i got graded by someone who didnt even know the subject. 3. The person that ended up grading my exam was NOT MY PEER. Appeared to be a female living in Africa. Could not have been further from being a peer of mine. 4. There was an entire forum of ""grade me easy and i'll grade you easy"". IE a corrupt buddy system that wasnt even a true measure of anything i might have learned in the class. 5. Overall the grading stalled and appeared to be a tactic to push me over the time limit so i had my credit card was charged again for simple ""time on the clock"" vs controlling my own destiny as was with the deceptive start of the course. 6. When i finally complained i was IMMEDIATELY PASSED and GIVEN my certificate. Any benefit this course series might have offered has been completely obliterated by the laziness and deception of the course organizers. Disappointment doesnt even begin to define how i feel regarding this course, coursera.org, Penn Law and the professor that taught this course. When we look at the decline of America, all of you are not just part of the problem. You ARE the problem. ",By craig b,"Jul 14, 2020",1
Cost and Economics in Pricing Strategy,BCG,https://www.coursera.org/learn/uva-darden-bcg-pricing-strategy-cost-economics,uva-darden-bcg-pricing-strategy-cost-economics,"While the beginning of the course was really interesting, the overall quality dropped halfway through. The sessions didn't look very professional. It first touched base on some very basic topics and then randomly went onto very technical information. Very disappointed. ",By Anuja,"Jul 13, 2020",3
Write A Feature Length Screenplay For Film Or Television,Michigan State University,https://www.coursera.org/learn/write-a-feature-length-screenplay-for-film-or-television,write-a-feature-length-screenplay-for-film-or-television,"I am trying to unenrol from the class, and it won't let me.   I don't find all these peer review elements useful, and they are just a big time issue.  How do I unenrol and also delete my screenplay pitch?  I liked the instructor in the video, but it just seems like it's not enough of him, and too much simplistic reviews from inexperienced students.",By Vianne,"Oct 09, 2020",1
Marketing Gerencial,Universidad de Chile,https://www.coursera.org/learn/marketing-gerencial,marketing-gerencial,"Considero que este curso no tuvo un acompañamiento del tutor por medio de más vídeos informativos y lecturas didácticas en donde se evidencien ejemplos. No estoy conforme con el mismo debido a que el único material que se suministraba eran capítulos enteros de un libro que se debían leer para completar el cuestionario; acción que cada persona puede hacer autonomamente sin estar registrada en un curso y mucho menos pagar por el mismo. Este curso no tuvo para mi un valor agregado, pues considero que leer tantos capítulos de un mismo libro por una plataforma, no me aporta nada distinto a leer el material en una biblioteca por mi cuenta.",By Francy T S C,"Mar 11, 2017",1
Corporate Finance Essentials,IESE Business School,https://www.coursera.org/learn/corporate-finance-essentials,corporate-finance-essentials,"The values in the calculation must match the values given by the professor. And in response to other students to the same question (my question was generally ignored), they say it is not important, not necessary, because the professor uses his numbers. Sorry, but this is fundamentally wrong. It is impossible to fix the material if the answers are different when calculating between a student and a professor!",By Diana D,"Nov 12, 2019",1
Information Security: Context and Introduction,"Royal Holloway, University of London",https://www.coursera.org/learn/information-security-data,information-security-data,"The quiz: Authentication and Authorisationis unbelievably and indescribably foolish. It's easy to prove: when you start the video ""Authentication and Authorization""  you have been informed that most of the users looks this video more than 1 time, and it's not because it's important, it's because video is not answering to one of the questions, and converting the quiz to closed loop which couldn't be resolved. Check how many people succeeded in this quiz. It's not because it is hard, it because is failure of someone who prepared it. just - WASTE OF TIME!",By Eldar B,"Aug 13, 2017",1
"Anatomy of the Chest, Abdomen, and Pelvis",Yale University,https://www.coursera.org/learn/trunk-anatomy,trunk-anatomy,Totally boring,By Dag S,"May 08, 2018",1
Introduction to CSS3,University of Michigan,https://www.coursera.org/learn/introcss,introcss,"This has to be the poorest educational experience Ive ever had.  Virtually nothing is explained.  The instructor says time & time again that she's not going to bother to explain in detail and that we should go out & explore all these free resources if we want to learn.  SO WHY DID I PAY FOR THIS CLASS? Honestly, save your money.  This is nothing but a rip-off and I am shocked that an institution like U of M would allow such a sloppy, lazy product to be out there under its brand. To make matters worse, we are instructed time & time again to go out onto the discussion board and ask for help when she doesn't want to bother explaining a concept.  1.  Everyone else taking this class is confused too - how could they possibly be of any help to me?2. The staff who comes onto the boards are just about as rude & unhelpful as any I've ever seen.  They literally say ""well, did you WATCH the lecture?""  Ummm- yes I did & it directed me to come here for help.I feel duped.  This is a scam and I can only say I am sorry I paid my money for this.  If you really want to learn CSS, get yourself a good book on the subject and/or utilize the free material out on the internet.  This will absolutely waste hours of your time and way too much of your money for what they are providing.  ",By Rose L,"Mar 02, 2016",1
Applied Data Science Capstone,IBM,https://www.coursera.org/learn/applied-data-science-capstone,applied-data-science-capstone,"Capstone implies apply what you learned throughout the program.  I appreciate that you were able to work in things you learned of your choice if you wanted to, but the sole requirement and focus of the capstone shouldn't be to include something that was just introduced.  Also, the graded lab that isn't part of the final project cannot be completed with the knowledge provided by this course.  I should NEVER receive instructions to check out more help on YouTube from a course for which I am paying.  I will not recommend this course to anyone.",By Shannon R J,"Dec 02, 2019",1
Introduction aux Droits de l’Homme,University of Geneva,https://www.coursera.org/learn/droits-de-lhomme,droits-de-lhomme,La certificación no indica nada que acredite que el curso fue desarrollado y aprobado. No se indica ni cantidad de horas cursadas ni una firma de algún docente o directivo de la Universidad que supuestamente lo imparte.,By Alexis G P,"Jul 03, 2018",1
"Programming Languages, Part A",University of Washington,https://www.coursera.org/learn/programming-languages,programming-languages,a little boring. I spent lots of time on learning on an useless language rather than learning the spirit of functional programming. I suppose to use C/C++\python or other normal programming language as the lesson language.,By 张浥东,"Nov 18, 2016",1
