titulo,institución,url_curso,id_curso,reseñas,revisores,fecha_reseñas,valoración
Project Planning,"University of California, Irvine",https://www.coursera.org/learn/project-planning-1,project-planning-1,"I found this course to be derivative of the Project Launch course. There was little value added and a lot of repetition throughout the course. There was also the issue of the quiz questions not being specifically covered in the course material. For instance, in the Agile week 6 it was obvious the test questions were copied from an agile specific course as many of the questions were not covered and terms not defined in the previous course material.To improve, I would recommend to combine the Project Launch and Project Planning courses, and make it an 8 week course. With the additional course, create a course entirely devoted to Agile PM as this is an entirely different mindset with a different vocabulary than traditional PM. ",By Lauren R,"Oct 19, 2017",1
Agile Meets Design Thinking,University of Virginia,https://www.coursera.org/learn/uva-darden-getting-started-agile,uva-darden-getting-started-agile,Poor instruction methods. The faculty lacks teaching and pedagogical skills. Sorry,By John P ,"Jul 17, 2020",1
AWS Fundamentals: Going Cloud-Native,Amazon Web Services,https://www.coursera.org/learn/aws-fundamentals-going-cloud-native,aws-fundamentals-going-cloud-native,"This is not a ""course"" - it should be free content available to anyone interesting in AWS.   It is really a length sales pitch about why one should use AWS.   About the only thing you can actually learn is some basic AWS terminology if that would be new to you.",By Joe G,"Feb 05, 2019",1
Construction Project Management,Columbia University,https://www.coursera.org/learn/construction-project-management,construction-project-management,"Course is good. However, certificate issued is mentioned as '...online non-credit course...' which create confusion. Such words should not be included in certificate, rather such info (credit, non-credit etc.) should be on back-end. Just issue simple certificate that online course successfully completed by Mr. X which is offered by Columbia University-In the city of New York on Coursera. It does not make any sense to write that the course is credit, non-credit etc. Kindly refer other certificates issued by reputed org like edX by HarvardX. I am not happy with certificate.",By Vinod B,"Jun 09, 2020",1
Introduction to Mathematical Thinking,Stanford University,https://www.coursera.org/learn/mathematical-thinking,mathematical-thinking,"I found this course to be incomprehensible. The professor was rude and dismissive, when I asked for help.",By Christopher B,"Jan 17, 2019",1
Everyday Parenting: The ABCs of Child Rearing,Yale University,https://www.coursera.org/learn/everyday-parenting,everyday-parenting,I want my certificate...what shall i donow..Help me..i completed my courseGive me certificate so that i can rate 5 stars,By Najma. H,"Sep 05, 2020",1
Introduction to Healthcare,Stanford University,https://www.coursera.org/learn/intro-to-healthcare,intro-to-healthcare,The ethics unit examples were interesting.  The reading assignment was an exercise in download and store.,Started Oct 05,"Sep 09, 2020",4
Machine Learning with Python,IBM,https://www.coursera.org/learn/machine-learning-with-python,machine-learning-with-python,"The course concentrates more on Maths rather than explaining how algorithm can be implemented in Python. This is difficult for a someone with less knowledge in Maths. The lab exercises when compared to rest of the course is not satisfactory because in lab sessions, the algorithms were not explained and lacks Student excercise. It also lacks clarity around when to use which algorithm.",By Radhika K,"Feb 07, 2019",1
Terrorism and Counterterrorism: Comparing Theory and Practice,Universiteit Leiden,https://www.coursera.org/learn/terrorism,terrorism,didn't get my certificate just because i passed the deadline ,By Gargi g,"Jun 19, 2019",1
Data Management for Clinical Research,Vanderbilt University,https://www.coursera.org/learn/clinical-data-management,clinical-data-management,This course is poorly taught and very basic. The material is largely not related to data management and there was very little time to truly develop practical skills in REDCap. The lectures are first takes that have obvious mistakes (one guy literally starts over and they never edited this out). Completing this course is meaningless and does not provide any tangible benefit for employers and employees. The majority of peers did not do the assignments at all and their grading/feedback was not helpful.,By Conner I,"Sep 14, 2020",1
Sustainable Fashion,Copenhagen Business School,https://www.coursera.org/learn/sustainable-fashion,sustainable-fashion,"It needs to be more clearly communicated that a person who chooses to AUDIT this course CANNOT complete it, because they will not be allowed to submit the peer-graded assignment. It also needs to be communicated, that even if someone PAYS for the course, they may not be able to finish if there are not enough paying students to REVIEW their assignment. Bit of a rock and a hard place, really.That being said, the course is extremely well-made and informative. There are lots of mini-quizzes to check learning. ",By Melanie D,"Apr 20, 2020",2
Foundations of Data Science: K-Means Clustering in Python,University of London,https://www.coursera.org/learn/data-science-k-means-clustering-python,data-science-k-means-clustering-python,"i am giving this note because they read theirs textes. it is not a teaching method. ı could read myself as well. i don't' understand why they do like this. in addition, the project is not well planned.  ",By KUTLU,"Apr 17, 2020",2
Instructional Design Foundations and Applications,University of Illinois at Urbana-Champaign,https://www.coursera.org/learn/instructional-design-foundations-applications,instructional-design-foundations-applications,"My opinion is
influenced by my professional experience as a classroom teacher, that
utilizes the Flip model and other non-traditional instructional
practices.  In teacher professional development we talk a lot about
“best practices” and how best to reach our students, and this
class just fails miserably in achieving “best practices”.

As a teacher, I’m
not completely ignorant when it comes to the content of this course. 
Weeks 3 and 4 covered content I am familiar with and/or have received
specialized training concerning those topics.  Weeks 1 and 2 were
largely new information and really just provided me with vocabulary
and structured thinking to many things that I do already.  Returning
to “best practices”, the entire course simply fails to
demonstrate the concepts it is teaching.  Using Gagne’s Nine Events
of Instruction, the instructors have failed to gain the attention of
their audience, and they fail to recognize the impact of their
presentation style on the attitudes – specifically motivation and
engagement – of the audience.  


I would like to
share a few recommendations with you.  First, the instructional video
format.  A rule with instructional videos is that you can expect
about 1 minute of attention for every grade level.  So for a 9th
grader, don’t make your videos longer than about 9 minutes.  There
is a point of diminishing returns.  Keep your videos short.  A thirty-minute instructional video is a bad idea in general.  Break the video
into multiple parts to make it “digestible”, and not overload the
learner.  The “talking heads” format that is utilized is not
engaging.  The slides have too much text; if the learner has to read
the slides, then they aren’t listening to you.  None of the
presenters are engaging in personality or delivery.  Dr. Huang may be
an expert in this field, but his videos are long, his voice is
monotone, and he just doesn’t have a presence on screen.  Nothing
about any of the presenters’ deliveries makes learning in
this course exciting.  


Required reading in
this course needs to be altered.  I could have purchased a book on
Amazon for $20 that covered the same content in fewer pages and
would focus more on practicality than straight up theory.  The week 3
required reading was “unreadable”.  You could get the same result
of your required readings by just giving students a bullet list of
topics and having them do their own Google Search of terms.  That
would at least be active learning.  


Assessment design in
this course is poor.  The discussion prompts in videos are a waste of
time as every student creates their own thread in the discussion
forum and there is no incentive to dig through responses to get other
people’s opinions or views because it is not referenced directly in
the summative assessments.  Question design in the quizzes should be
changed as well.  Multiple choice questions are one thing, but
multiple choice-multiple answer questions are cruel.  The later
quizzes are extremely difficult because of this as phrasing and
structuring of answers is not referenced directly from the videos. 
This requires content fluency from the learner that has not been
practiced, developed or assessed prior to this quiz, so the learner
is left guessing and hoping.  Thankfully, there are essentially
unlimited retakes.  


THIS IS REALLY
IMPORTANT.  At the beginning of the course it is stated that this
course is part of the MicroMasters program.  According to the course
listing for that program on CoursEra….it’s not.  


I WOULD STRONGLY
RECOMMEND using a couple of case studies that are introduced at the
beginning of the course and are examined throughout the course as
topics and methods are discussed.  Draw parallels; point out possible
errors; DEMONSTRATE what you are talking about.  


As a teacher, I
always strive for student engagement.  This is even discussed during
the course, attitude/motivation has a big influence on the success of
the learning experience.  Make the course more engaging.  Right now I
don’t plan to continue the MicroMasters program because the
experience thus far has been a soul-sucking/motivation-draining
experience AND I’m not convinced the instructors can provide me
with any information, methods, etc., that I’m not already familiar
with that will improve my skills in the development, implementation,
and evaluation of my learning resources.  


",By Phillip G,"Aug 16, 2019",1
Cursos en línea: modelo para armar,Universidad Nacional Autónoma de México,https://www.coursera.org/learn/enlinea,enlinea,"Es un muy buen curso, el problema fue la premura en la entrega de las actividades.",By Juan M P V,"Sep 03, 2020",4
Modern Art & Ideas,The Museum of Modern Art,https://www.coursera.org/learn/modern-art-ideas,modern-art-ideas,"This is the worst and most lazily assembled online course I've ever seen. It is simply a slide-show of select pieces of modern art with some rambling commentary that could mean anything. The quizes are unnecessarily tricky, but to top it all off participants have to write two 500 word peer reviewed essays at the end. Peer reviewed. Like a final ""we don't care"" from the authors. Can't believe I wasted hours on this.",By Sigurd T,"Apr 11, 2018",1
"Speak English Professionally: In Person, Online & On the Phone",Georgia Institute of Technology,https://www.coursera.org/learn/speak-english-professionally,speak-english-professionally,"In my opinion this course does not teach you to 'speak English professionally', but it teaches you to 'learn how to speak English'. I was looking for a course that would teach me how to write professional emails and have professional phone conversations, like which words I should use, what common sentences are or how to build up professional sentences. I am a bit disappointed and think this course was a waste of time for me. This is really meant for people that are learning to speak English and don't know how to pronounce words or how to respond to people in a really easy way.",By Amber v d H,"May 13, 2016",1
Essential Google Cloud Infrastructure: Foundation,Google Cloud,https://www.coursera.org/learn/gcp-infrastructure-foundation,gcp-infrastructure-foundation,"The script is very boring. Narrative is very monotonous. It is better to read the script, which makes me to question the experience, and the money I paid for this.",By Arash B,"Aug 01, 2019",1
Introduction to Artificial Intelligence (AI),IBM,https://www.coursera.org/learn/introduction-to-ai,introduction-to-ai,"An interesting course, but some external links didn't work, and it's impossible to create an account with IBM Cloud, so there's no way to do the final exercise. A bit of a waste of time.",By Duncan G,"Jul 05, 2020",1
Dog Emotion and Cognition,Duke University,https://www.coursera.org/learn/dog-emotion-and-cognition,dog-emotion-and-cognition,"This course is not very informative, and it seems as though it is more of an advertisement to the lecturer's project then a real academic course",By Racheli N,"Oct 19, 2017",1
International Leadership and Organizational Behavior,Università Bocconi,https://www.coursera.org/learn/organizational-behavior,organizational-behavior,one of the most boring courses I have ever taken.....I had to force myself to finish it. the teacher is charismatic but the content is just theories and abstract ideas.....just blah blah blah,By Gianfranco M R,"Mar 25, 2016",1
Driving business towards the Sustainable Development Goals,Erasmus University Rotterdam,https://www.coursera.org/learn/sdgbusiness,sdgbusiness,It would've been a more balanced course if there had been more corporate examples from outside the Netherlands.,By Carel v R,"Jun 14, 2020",3
"The Sustainable Development Goals – A global, transdisciplinary vision for the future",University of Copenhagen,https://www.coursera.org/learn/global-sustainable-development,global-sustainable-development,"The topic of the course is crucial and very interesting, however, the Professor way of teaching and representing the materials of the course is boring, not inspiring and creative, I find it a bit outdated. ",By Madina K,"May 08, 2020",1
Digital Transformation,BCG,https://www.coursera.org/learn/bcg-uva-darden-digital-transformation,bcg-uva-darden-digital-transformation,not free at all,By Alvaro G,"Mar 13, 2019",1
Sequence Models,DeepLearning.AI,https://www.coursera.org/learn/nlp-sequence-models,nlp-sequence-models,"Tons of editing errors in lectures, and the programming problems rely more on knowledge of Keras (essentially untaught throughout the course) than they do on understanding of lecture material. A disgraceful end to an otherwise solid course sequence.",By Dylan R,"Oct 20, 2018",1
Devenir entrepreneur du changement,HEC Paris,https://www.coursera.org/learn/entrepreneur-changement,entrepreneur-changement,Banalité,By Dupré P,"May 06, 2020",1
Seeing Through Photographs,The Museum of Modern Art,https://www.coursera.org/learn/photography,photography,"No actual class, just for selling books.",By Felipe S C,"May 21, 2016",1
Entrepreneurship 1: Developing the Opportunity,University of Pennsylvania,https://www.coursera.org/learn/wharton-entrepreneurship-opportunity,wharton-entrepreneurship-opportunity,very basic and boring. very very elementary ,By omid a,"Sep 26, 2020",1
Introduction to Search Engine Optimization,"University of California, Davis",https://www.coursera.org/learn/search-engine-optimization,search-engine-optimization,Chapter 1 & 2 are mainly dedicated for SEO careers. Chapter 3 is only a description of Google SEO updates.Chapter 4 is just a wrap-up videoVery disappointed by the content of this course,By Christophe V N T,"Jun 21, 2019",1
Learn to Speak Korean 1,Yonsei University,https://www.coursera.org/learn/learn-speak-korean1,learn-speak-korean1,This course does not engage the audience. ,By Susan H,"Jul 17, 2020",1
Drug Development,University of California San Diego,https://www.coursera.org/learn/drug-development,drug-development,course material is very old. from 2013. I would highly recommend to update the study material. it was very disappointing that I was not able to get the picture of current drug development,By Ekaterine B,"Feb 20, 2018",1
R Programming,Johns Hopkins University,https://www.coursera.org/learn/r-programming,r-programming,"I have a rudimentary background in R programming and a lot of experience with computers.  I really doubt that someone with no programming experience would be able to complete this course.  In many instances, the tools and functions needed to compete programming assignments were not taught.  In addition, functions that are taught in the class are not used at all in the homework.  The final assignment was unncessarily complicated and time consuming.  I would not recommend this class to someone who is new to programming.",By James C,"Jan 07, 2018",1
Economics of Money and Banking,Columbia University,https://www.coursera.org/learn/money-banking,money-banking,It is tottaly unacceptable to have to pay to pass quizz !!!I cancel my participation,By VIALA C,"Mar 10, 2017",1
Chinese for Beginners,Peking University,https://www.coursera.org/learn/learn-chinese,learn-chinese,"Not a very interesting class, only learned some vocabulary and some pre made sentences, but no general structure or grammar. This means that it would be impossible for me to even guess how to form an other sentence with the words i know.",By Yerly L,"Jul 30, 2017",1
Grammar and Punctuation,"University of California, Irvine",https://www.coursera.org/learn/grammar-punctuation,grammar-punctuation,"You should tell people before they enroll that, to take the quizzes, they must pay. It was a waste of time...",By Carolina T,"Jun 22, 2016",1
Japanese for beginners 1,Saint Petersburg State University,https://www.coursera.org/learn/japanese-1,japanese-1,"Very uninspiring. A whole 15 minutes of phonetics might sound like a good idea for a textbook but definitely not for an online course. Phonetics can be taken step by step while learning some basic sentence constructions. By the end of the 15 minutes, no one will be able to remember 10% of the information provided. Also not having an actual person teaching a language is counterproductive. The movement of the lips and mouth in general are extremely important for pronunciation.  ",By Claudia,"May 21, 2020",1
Introduction to English Common Law,University of London,https://www.coursera.org/learn/intro-common-law,intro-common-law,Short and Crispy with point to point explanation,By ADI S P R,"Aug 29, 2019",3
Introduction to Dental Medicine,University of Pennsylvania,https://www.coursera.org/learn/dental-medicine-penn,dental-medicine-penn,A bit difficult in terms or using very complicated words....,By Iram A,"Apr 28, 2017",2
Fundamentals of Reinforcement Learning,Alberta Machine Intelligence Institute,https://www.coursera.org/learn/fundamentals-of-reinforcement-learning,fundamentals-of-reinforcement-learning,I found the explanations of theory of RL to replicate what was written in the book. Without examples the videos were no value add. I had to go through the RL course by David Silver in youtube to understand the concepts. ,By Avinash K,"Aug 08, 2019",1
The Power of Macroeconomics: Economic Principles in the Real World,"University of California, Irvine",https://www.coursera.org/learn/principles-of-macroeconomics,principles-of-macroeconomics,"I have been quite disappointed by this class. There were no suggested readings in addition to the quite basic videos. But the worst were the quizzs. 90% of the answers to the multiple-choice questions were the top option!! I could have pass the tests without having listen to the videos. Were those tests or jokes? You should do this class only if you know absolutely nothing about economics, because this is the most basic class.",By Sarah G,"Nov 20, 2016",1
Corporate Sustainability. Understanding and Seizing the Strategic Opportunity,Università Bocconi,https://www.coursera.org/learn/corp-sustainability,corp-sustainability,Zero should be an option.  How do I drop out?,By Susannah S,"Apr 27, 2020",1
Behavioral Finance,Duke University,https://www.coursera.org/learn/duke-behavioral-finance,duke-behavioral-finance,"Duke.... Coursera... guys, come on!  I'd like to contrast this with the Wharton Business Analytics specialization that I'm completing.  It was like night and day.  I mean, professors in that course are presenting their own research!  Cade Massey presents research he did with Dick Thaler!  None of that happens here.  The information shared doesn't even flow smoothly.  This course relies mainly on PDF slides (if I wanted to read, I would've bought a book).  At one point, it even links to 6 articles on another website (and that's in the quiz as well).  It seems like very little effort was put into this online class by the professors.  The slides themselves seemed scatter-brained, several times asking questions that are never even answered.  It was almost as if someone took already prepared slides from a course and just kind of mashed them with a very little bit of video to make an ""online"" course.  Even the answers to quizzes seemed extremely vague (it often felt like there were several right answers... or none -- to me, this is sloppy quiz writing).I honestly expected better from both Coursera and Duke!  The only redeeming part about this course is that behavioral economics is honestly compelling, despite the shortcomings pointed out.",By Dane C,"Aug 29, 2016",1
"Sequences, Time Series and Prediction",DeepLearning.AI,https://www.coursera.org/learn/tensorflow-sequences-time-series-and-prediction,tensorflow-sequences-time-series-and-prediction,"The first week has some interesting discussion of time series data and some traditional non-ML methods for forecasting, but beyond that the course quickly divulges the all too familiar weaknesses of this specialization; lack of depth, elementary discussion, weak insight into common problems that arise during training models, and extremely poorly written quizzes that don't test the learner's gain of knowledge or skills in any meaningful way.My biggest complaint to the instructors and the team is that for months this specialization promised the last course will discuss the WaveNet model, but the course didn't even do a cursory survey of it (In week 4, the instructor adds a Conv1D layer but doesn't even discuss the causal padding and completely skips dilations, etc, so that in effect there isn't even discussion of a single layer from WaveNet model).  Sigh !",By Asad K,"Jul 31, 2019",1
Supply Chain Logistics,Rutgers the State University of New Jersey,https://www.coursera.org/learn/supply-chain-logistics,supply-chain-logistics,"Unfortunately I think the level for this course is very low and not worth paying for, it has a very local perspective of logistics (not involving international logistics but only US operations), there's no communication with the professor or assistants, so it's basically watching a few very short videos explaining general concepts that apply only to certain types of operations. The assignments are very vague, with no requirements or restrictions provided, basically anyone can write anything and as long as you follow the requested format it will be graded ok; grading is not based content and therefore there's no way to know whether you're learning and applying the concepts properly or not.Wouldn't recommend paying for it.  ",By Mauricio A L L,"Nov 01, 2016",1
Project Execution,"University of California, Irvine",https://www.coursera.org/learn/project-execution,project-execution,Professor didn't grade work all course long.  Many of my assignments are still ungraded. All assignments graded after course end could not be seen which also means grade feedback cannot be seen either.   ,By Nikole H,"Sep 25, 2018",1
Nutrición y obesidad: control de sobrepeso,Universidad Nacional Autónoma de México,https://www.coursera.org/learn/nutricion-obesidad-sobrepeso,nutricion-obesidad-sobrepeso,"El curso tiene información muy básica, usan buen lenguaje, de fácil entendimiento para el público en general, sin embargo me da pena que una de las instituciones más reconocidas del país aún maneje información tan obsoleta, el folleto que otorgan es en base a la Encuesta Nacional de Nutrición 2012, hay encuestas más recientes, la norma oficial la cuál la última revisión también tiene más de 6 años, los ""Alimentos de mayor consumo por el hospital Salvador Zubirán de 1996"" (hace más de 20 años), el Instituto de salud pública tiene publicaciones muy recientes acerca del panorama de salud en México, y no se diga del Instituto Salvador Zubirán, se siguen dando recomendaciones muy obsoletas, como insistir en los 8 vasos de agua, hace un tiempo la OMS aclaró que el consumo de agua tiene que satisfacer las necesidades de la persona, a menos que esta sufra algún padecimiento específico como problemas renales, ascitis, etc. Siguen utilizando el sistema de intercambios cuando el plato del bien comer es un material más preciso; y para acabar el área de actividad física también es muy simplista, la persona del video que hace ejercicio no trae la ropa adecuada y no realiza los ejercicios de manera adecuada. Soy nutrióloga, me gusta tomar estos cursos para ver qué tipo de material está accesible para la gente en general, estoy segura que si se dan una vuelta por otros cursos que ofrecen en esta misma plataforma será de gran utilidad para mejorar este curso, como nutrióloga y como mexicana me dio mucha verguenza ver este material, y entonces caigo en cuenta del porque tenemos la crisis de salud que tenemos.",By Amaranta P,"Nov 20, 2019",1
